{
  "id": "interface",
  "path": "configs/interface.toml",
  "exists": true,
  "values": {
    "theme": "dark",
    "font_sans": "inter",
    "font_mono": "jetbrains",
    "font_size": 14,
    "line_height": 1.5,
    "density": "comfortable",
    "reduced_motion": false
  },
  "defaults": {
    "theme": "light",
    "font_sans": "inter",
    "font_mono": "jetbrains",
    "font_size": 14,
    "line_height": 1.5,
    "density": "comfortable",
    "reduced_motion": false
  }
}
